[{"basis":"self_created","confirmedAt":"2026-11-01T14:06:32.600Z","confirmedBy":"system_policy","licenseId":"OFL-1.1 (fonts)","notes":["既存サイト内の表紙用途。外部サービス不使用。技術的観測の証拠ではありません。"],"ownerOrSource":"Xpotato site-owned logo and authored vector composition; bundled SIL OFL fonts","publicationAuthorized":true,"rightsId":"generated-cover-rights","schemaVersion":1},{"basis":"ai_generated_authorized","confirmedAt":"2026-11-01T00:29:29.677Z","confirmedBy":"user","notes":["本人の既成記事・ロゴ無し表紙・8図の一般公開依頼を正規化。正確な候補への人間承認や監査結果ではない。"],"ownerOrSource":"本人が制作を依頼し採用したロゴ無し生成イメージ","publicationAuthorized":true,"rightsId":"received-hero-rights","schemaVersion":1},{"basis":"self_created","confirmedAt":"2026-11-01T00:29:29.677Z","confirmedBy":"user","notes":["本人の既成記事・ロゴ無し表紙・8図の一般公開依頼を正規化。正確な候補への人間承認や監査結果ではない。"],"ownerOrSource":"Xpotato記事のために作成したコード由来の説明図。公式製品アイコンの複製なし。","publicationAuthorized":true,"rightsId":"received-walls-a-rights","schemaVersion":1},{"basis":"self_created","confirmedAt":"2026-11-01T00:29:29.677Z","confirmedBy":"user","notes":["本人の既成記事・ロゴ無し表紙・8図の一般公開依頼を正規化。正確な候補への人間承認や監査結果ではない。"],"ownerOrSource":"Xpotato記事のために作成したコード由来の説明図。公式製品アイコンの複製なし。","publicationAuthorized":true,"rightsId":"received-walls-b-rights","schemaVersion":1},{"basis":"self_created","confirmedAt":"2026-11-01T00:29:29.677Z","confirmedBy":"user","notes":["本人の既成記事・ロゴ無し表紙・8図の一般公開依頼を正規化。正確な候補への人間承認や監査結果ではない。"],"ownerOrSource":"Xpotato記事のために作成したコード由来の説明図。公式製品アイコンの複製なし。","publicationAuthorized":true,"rightsId":"received-walls-c-rights","schemaVersion":1},{"basis":"self_created","confirmedAt":"2026-11-01T00:29:29.677Z","confirmedBy":"user","notes":["本人の既成記事・ロゴ無し表紙・8図の一般公開依頼を正規化。正確な候補への人間承認や監査結果ではない。"],"ownerOrSource":"Xpotato記事のために作成したコード由来の説明図。公式製品アイコンの複製なし。","publicationAuthorized":true,"rightsId":"received-orientation-a-rights","schemaVersion":1},{"basis":"self_created","confirmedAt":"2026-11-01T00:29:29.677Z","confirmedBy":"user","notes":["本人の既成記事・ロゴ無し表紙・8図の一般公開依頼を正規化。正確な候補への人間承認や監査結果ではない。"],"ownerOrSource":"Xpotato記事のために作成したコード由来の説明図。公式製品アイコンの複製なし。","publicationAuthorized":true,"rightsId":"received-orientation-b-rights","schemaVersion":1},{"basis":"self_created","confirmedAt":"2026-11-01T00:29:29.677Z","confirmedBy":"user","notes":["本人の既成記事・ロゴ無し表紙・8図の一般公開依頼を正規化。正確な候補への人間承認や監査結果ではない。"],"ownerOrSource":"Xpotato記事のために作成したコード由来の説明図。公式製品アイコンの複製なし。","publicationAuthorized":true,"rightsId":"received-roof-a-rights","schemaVersion":1},{"basis":"self_created","confirmedAt":"2026-11-01T00:29:29.677Z","confirmedBy":"user","notes":["本人の既成記事・ロゴ無し表紙・8図の一般公開依頼を正規化。正確な候補への人間承認や監査結果ではない。"],"ownerOrSource":"Xpotato記事のために作成したコード由来の説明図。公式製品アイコンの複製なし。","publicationAuthorized":true,"rightsId":"received-roof-b-rights","schemaVersion":1},{"basis":"self_created","confirmedAt":"2026-11-01T00:29:29.677Z","confirmedBy":"user","notes":["本人の既成記事・ロゴ無し表紙・8図の一般公開依頼を正規化。正確な候補への人間承認や監査結果ではない。"],"ownerOrSource":"Xpotato記事のために作成したコード由来の説明図。公式製品アイコンの複製なし。","publicationAuthorized":true,"rightsId":"received-roof-c-rights","schemaVersion":1}]
